{
  "work_unit": "work-unit-465-freshen-built-in",
  "grounded_against": {
    "commit": "1e751e9b",
    "grounded_at": "2026-07-05T08:57:19Z",
    "tracker_state": "issue body, comment log, labels, milestone, and linked issue state at acquisition"
  },
  "staleness_finding": "The work remains valid, but current substrate reveals a blocker that must close first.",
  "graph_finding": {
    "blockers": "One blocking work-unit is open.",
    "blocked": "No downstream blocked work-units require relinking before entry.",
    "epic_membership": "No parent epic membership changed.",
    "siblings": "No sibling or duplicate absorbed this scope.",
    "milestone": "No milestone is assigned.",
    "labels": "The enhancement label remains accurate."
  },
  "disposition": "reblock"
}
